Date,Title
2025-08-27T21:36:58Z,Nvidia is boosting its stock-buyback program by a record $60 billion
2025-08-27T21:25:39Z,Phreesia Gains A New Bull. Why the Stock Is a Buy
2025-08-27T21:03:11Z,Chip Makers Fall With Nvidia Shares
2025-08-27T21:03:10Z,"Nvidia's stock falls as sales growth slows, profit margins fade 's” follow live"
2025-08-27T21:02:43Z,Trading Day: Nvidia beats but shares retreat
2025-08-27T20:51:25Z,"Nvidia's Data Center Revenue Soared in Second Quarter, but Still Misses Wall Street Estimate"
2025-08-27T20:45:51Z,Delivery Companies Around the World Stop Shipments to the US: Here's Who's Affected
2025-08-27T20:40:23Z,Tesla Stock Keeps Climbing Despite All Its Woes: Should You Buy or Sell TSLA Here?
2025-08-27T20:39:59Z,"After a 222% Surge, Is SoFi Stock Headed Even Higher?"
2025-08-27T20:36:56Z,S&P 500 Posts a Record High on Nvidia Earnings Optimism
2025-08-27T20:28:53Z,Nvidia's earnings are out. Here are the key numbers driving the stock lower
2025-08-27T20:28:48Z,HP Inc. Stock Rises on Strong Earnings. It Avoided China Tariffs by Moving Production: CEO
2025-08-27T20:27:24Z,"Nvidia earnings live: Stock falls on data center revenue miss. Also: Snowflake pops, CrowdStrike drops"
2025-08-27T20:17:50Z,"Dear Broadcom Stock Fans, Mark Your Calendars for September 4"
2025-08-27T20:17:46Z,Should You Buy the Post-Earnings Pop in MongoDB Stock?
2025-08-27T20:06:16Z,S&P 500 Gains Ahead of Nvidia Earnings
2025-08-27T19:32:35Z,"Oil Gains as U.S. Stocks Draw, India Tariffs Take Effect"
2025-08-27T19:12:51Z,"Sinha calls upon NHAI to assist PWD in restoring J&K's roads, national highways"
2025-08-27T19:08:15Z,"Open to rethink on restrictions on FDI from China, says official"
2025-08-27T19:07:10Z,"European Trade Commissioner may visit India next month, FTA on agenda"
2025-08-27T18:14:01Z,Trump's 50% tariffs on India over Russian oil purchases take effect
2025-08-27T18:13:07Z,Wall Street edges higher as the market awaits Nvidia's quarterly report
2025-08-27T18:00:15Z,"Transcript: President Trump Remarks on FIFA World Cup, Putin, DC Crime"
2025-08-27T17:25:58Z,Cheetahs Feast and Sloths Snooze in These Stunning Wildlife Photographer of the Year Entries
2025-08-27T17:21:40Z,EU Trade Commissioner Likely To Visit India Next Month; May Meet Goyal On FTA
2025-08-27T15:45:55Z,"Finland's President Stubb, PM Modi discuss Russia-Ukraine war, agree to deepen India-EU ties"
2025-08-27T15:30:00Z,Why America Isn'st Rome (And Why That Matters)
2025-08-27T15:26:35Z,"US stock market surges as Nvidia nears all-time highs: Dow, S&P 500, Nasdaq rally as Wall Street awaits earnings"
2025-08-27T15:25:08Z,"Three retailers, 3 distinct front-loading strategies: What these plans says about their businesses"
2025-08-27T15:24:54Z,Salesforce Stock Has Had a Terrible 2025. It Might Be Too Cheap to Pass Up
2025-08-27T15:22:12Z,Stocks Rebound Ahead of Nvidia's Earnings
2025-08-27T15:13:37Z,West Pharmaceutical Stock: Is Wall Street Bullish or Bearish?
2025-08-27T15:13:33Z,CEO Alex Karp Just Sold $60 Million in Palantir Stock. Should You Ditch PLTR Here Too?
2025-08-27T15:08:17Z,"China Market Update: The Good (Cambricon Results), The Bad (Profit Taking Downdraft), & The Ugly (Food Delivery Price Wars)"
2025-08-27T14:58:34Z,"Texmaco, RVNL form JV to boost India's railway modernisation, exports"
2025-08-27T14:50:45Z,Intel Is Different Than Lockheed. The Case Against U.S. Government Investment in Defense
2025-08-27T14:28:36Z,"Nvidia, MongoDB, Kohl's, Cracker Barrel, nCino, Smucker, and More Market Movers"
2025-08-27T14:21:32Z,"Texmaco, RVNL form JV to boost rail modernisation, exports"
2025-08-27T14:17:16Z,"China Has Its Own Nvidia. Watch This Stock as AI-Driven Sales Soar 4,000%"
2025-08-27T14:17:11Z,Do Wall Street Analysts Like Labcorp Holdings Stock?
2025-08-27T14:15:32Z,Stocks Pressured as Bond Yields Climb and Chip Makers Slide
2025-08-27T14:07:05Z,Okta Stock Rises. What Analysts Are Saying About Earnings
2025-08-27T14:05:52Z,Williams-Sonoma Stock Rises on Earnings. Tariffs Aren'st Yet an Issue
2025-08-27T14:05:42Z,Nvidia Stock Falls in Early Trading
2025-08-27T14:03:09Z,"International trade should happen voluntarily, not under pressure: RSS Chief amid India-US tariff row"
2025-08-27T14:00:00Z,The declining mental health of the young and the global disappearance of the unhappiness hump shape in age
2025-08-27T13:57:00Z,"Global Residential Construction Market Growth Analysis and Outlook Report 2025-2034 | Expansion Spurred by Affordable Housing Demand, Green Building Practices, and Adoption of BIM & 3D Printing"
2025-08-27T13:54:43Z,O'sReilly Automotive Stock: Analyst Estimates & Ratings
2025-08-27T13:54:33Z,"Republicans discover socialism isn'st so bad when they do it, with Trump vowing more deals like Intel to come"
2025-08-27T13:54:27Z,What Are Wall Street Analysts' Target Price for STERIS Stock?
2025-08-27T13:46:44Z,India to send over 700 soldiers to participate in 'Exercise Bright Star 2025'
2025-08-27T13:44:22Z,"Chinese AI chip designer Cambricon reports H1 2025 revenue up 44x YoY to $405.2M and a $144M profit, after Beijing encouraged companies to use homegrown tech"
2025-08-27T13:44:21Z,"OpenAI plans to update ChatGPT to better respond to mental distress cues, provide parental controls, and bolster safeguards around conversations about suicide"
2025-08-27T13:44:19Z,"A look at Xiaomi's evolution from a tech assembler to a high-tech manufacturer, as it applies its smartphone manufacturing strategy to developing EVs and chips"
2025-08-27T13:44:19Z,"Tussell: UK government contracts for AI-related projects have reacheda£573M in 2025 to July 15, up froma£468M for the whole of 2024, as it seeks efficiency"
2025-08-27T13:44:19Z,"Apple partners with TuneIn to make Apple Music's six radio stations available outside its app, a first, as it seeks to compete with Spotify; TuneIn has 75M MAUs"
2025-08-27T13:44:17Z,Sources: OpenAI's restructuring may slip into 2026 as it negotiates with Microsoft; failure to reach a deal in 2025 would let SoftBank withhold its $10B funding
2025-08-27T13:44:15Z,"A look at the possible remedies a US court might impose on Google after its antitrust loss last year, including a breakup, with a decision expected this week"
2025-08-27T13:44:13Z,"UK-based Yoto, whose screen-free speakers for kids play audiobooks and music, reports 2024 revenue up 86% YoY to a £94.8M and expects to turn a profit in 2025"
2025-08-27T13:44:12Z,"South Korean lawmakers pass a bill to ban using mobile phones and other smart devices during classes at elementary and middle schools nationwide, starting 2026"
2025-08-27T13:44:12Z,"Q&A with General Catalyst's Hemant Taneja on the VC firm's AI roll-up's strategy to buy service businesses and inject them with AI, investment bubbles, and more"
2025-08-27T13:44:10Z,"Taiwan indicts three people for allegedly stealing TSMC's 2nm secrets to help Tokyo Electron, the first such case, and recommends a combined 14-year prison term"
2025-08-27T13:44:06Z,Court filing: Elon Musk's lawyers ask a US judge to block OpenAI from obtaining documents from Meta related to a previous $97.4B bid for OpenAI's assets
2025-08-27T13:44:00Z,"President Trump says Meta plans to spend $50B on its Hyperion's data center under construction in Louisiana; earlier, Meta said the investment would exceed $10B"
2025-08-27T13:44:00Z,"Meituan reports Q2 revenue up 11.7% YoY to $12.8B and net income down 97% YoY to $51M, blaming 'soeirrational competition's in the Chinese food delivery market"
2025-08-27T13:43:59Z,"Malaysian chip designer SkyeChip unveils the MARS1000, the country's first edge AI processor, as Malaysia seeks to climb the global semiconductor value chain"
2025-08-27T13:43:58Z,Ryanair expects Boeing to boost 737 output to 42 per month by October
2025-08-27T13:43:58Z,"Internal memo: Indian IT services giant TCS forms a new unit for AI-based operations and names Amit Kapur, who led TCS' UK and Ireland business, as its chief"
2025-08-27T13:43:57Z,"MongoDB reports Q2 revenue up 24% YoY to $591.4M, vs. $553.9M est., net loss down 14% to $47M, and increases its full-year guidance; MDB jumps 28%+"
2025-08-27T13:43:51Z,"Sources: a Chinese fab making Huawei's AI chips is set to start production as soon as the end of 2025, with two more due in 2026; the fabs' ownership is unclear"
2025-08-27T13:43:51Z,"Google DeepMind's Weather Lab, launched in June, showed superior accuracy in forecasting Hurricane Erin's path up to 72 hours ahead, beating traditional models"
2025-08-27T13:43:48Z,"After Sydney Sweeney Controversy, American Eagle Taps Travis Kelce to Sell Jeans"
2025-08-27T13:43:46Z,Dangote Fuel Rollout Delayed by China Truck Shipping Bottleneck
2025-08-27T13:43:45Z,Energy Transfer LP price target lowered to $23 from $24 at Morgan Stanley
2025-08-27T13:43:38Z,Is Wall Street Bullish or Bearish on Corpay Stock?
2025-08-27T13:43:33Z,MarketAxess Holdings Stock: Is Wall Street Bullish or Bearish?
2025-08-27T13:43:32Z,Kyrgyzstan begins mining gold at Kumtor deposit after nationalisation
2025-08-27T13:43:31Z,Ukrainian drone attacks on oil refineries have some Russian regions running on empty
2025-08-27T13:43:25Z,Danger ahead! Five examples of risky central bank politicization
2025-08-27T13:43:22Z,Stocks Are Little Changed Ahead of Nvidia's Earnings Report
2025-08-27T13:43:20Z,Russia slashes 2025 economic growth forecast to 1.5% from 2.5%
2025-08-27T13:43:19Z,An indicator of commercial real estate transaction volume just improved for the first time this year
2025-08-27T13:35:38Z,What India can learn from Trump's Intel playbook
2025-08-27T13:32:45Z,UPS Outsources Forecasting Operation to Weather Channel Owner
2025-08-27T13:32:37Z,Are Wall Street Analysts Predicting Gartner Stock Will Climb or Sink?
2025-08-27T13:32:37Z,Activist Elliott Is Said to Take Large Stake in Rexford REIT
2025-08-27T13:32:34Z,Meloni Seeks Reform to Let Italians Directly Choose Premiers
2025-08-27T13:32:28Z,MongoDB Stock Soars After Q2 Results. Database Player Answers Gen AI Software Concerns
2025-08-27T13:32:28Z,Activist Plantro Pushes Calian to Sell Amid Defense Tailwinds
2025-08-27T13:32:27Z,MAI Capital Management Is Buying Evoke Advisors. It Will Nearly Double in Size
2025-08-27T13:32:26Z,Russia slashes 2025 economic growth forecast to 1.5% from 2.5%
2025-08-27T13:32:22Z,Orlen Reshuffle Heralds More Uncertainty for Polish Stock Market
2025-08-27T13:32:18Z,"Slovenia Urges EU to Address Uneven Response to Israel, Russia"
2025-08-27T13:32:15Z,Japan's Sompo to buy New York-listed insurer Aspen for $3.5bn
2025-08-27T13:32:07Z,Is Wall Street Bullish or Bearish on News Corporation Stock?
2025-08-27T13:21:15Z,Companies Enhance Economic Data Products With Trust in US Statistics Wavering
2025-08-27T13:21:15Z,T-Mobile bets on 'SuperMobile' plan to attract business customers
2025-08-28T21:55:00Z,Satisfaction of Additional Price Condition and Confirmation of Warrant Expiration Date
2025-08-28T21:15:39Z,Hammond Power Solutions Declares Quarterly Dividend
2025-08-28T21:08:21Z,The Reds's Newest Infield Question
2025-08-28T20:38:22Z,S&P 500 Posts a New Record High on a Resilient US Economy
2025-08-28T20:04:04Z,Economics & Investing For Preppers
2025-08-28T19:06:31Z,"Dear Apple Stock Fans, Mark Your Calendars for September 9"
2025-08-28T18:38:52Z,Time to take Indo-Japan ties to next level
2025-08-28T18:19:30Z,"Left hits out at US President attempt to 'dictate', asks PM Modi to stand up to counter"
2025-08-28T18:01:13Z,Combating the Malnutrition Menace
2025-08-28T17:37:06Z,Best Buy stock falls as guidance reveals doubts about tariff impacts
2025-08-28T16:10:21Z,Trump tariffs are increasingly forcing countries to pick sides between the US and China
2025-08-28T16:09:56Z,US agencies distance themselves from Chinese-founded PDF software
2025-08-28T15:56:53Z,Coal India to kick off roadshows for BBCL and CMPDI IPOs soon to start gauging investors's interest
2025-08-28T15:44:58Z,FPIs Extend Selling Streak For Fourth Session As Markets Extend Decline
2025-08-28T15:35:26Z,"These Stocks Are Moving the Most Today: Nvidia, Snowflake, Pure Storage, CrowdStrike, Hormel Foods, Cooper, HP, and More"
2025-08-28T15:35:26Z,Broadcom Stock Rises After Nvidia Earnings. How the Results Impact the Chip Sector
2025-08-28T15:35:11Z,FedEx Supply Chain to layoff 600 workers at Cummins warehouse
2025-08-28T15:35:05Z,"Major Russian attack includes rare strikes on the center of Kyiv, killing at least 18"
2025-08-28T15:35:03Z,Easing Global Supply Concerns Weigh on Crude Prices
2025-08-28T15:34:54Z,EU proposes tariff removal on US imports to speed up lower US car duties
2025-08-28T15:34:54Z,"With the French Government in Tumult, Sell the Euro Here"
2025-08-28T15:34:50Z,Nvidia Earnings Disappointed. GE Vernova and 5 More Industrial Stocks Get a Boost
2025-08-28T15:34:36Z,"Phillips 66 to begin winding down Los Angeles-area refinery next week, sources say"
2025-08-28T15:34:34Z,India's The Burger Company adopts new micro-QSR franchise format
2025-08-28T15:24:04Z,Fed Governor Lisa Cook Sues Trump Over Dismissal
2025-08-28T15:23:54Z,Tesla's European Sales Were Dreadful. Why the Stock Is Rising Anyway
2025-08-28T15:23:48Z,Canada and India Name New Ambassadors in Sign of Warming Ties
2025-08-28T15:23:47Z,Russia's Mechel halts some coal operations as industry faces crisis
2025-08-28T15:23:38Z,Brazil carries out raids in crackdown on organized crime in the fuel sector
2025-08-28T15:23:29Z,Nvidia Joins Google to Fund Commonwealth's Fusion Power Plant
2025-08-28T15:23:28Z,"Following Nvidia's Earnings, a Top Analyst Says the AI 's˜Boom Is Just Starting's"
2025-08-28T15:23:28Z,Gets 17% Boost as EU Ramps Up Trade Deal With Trump
2025-08-28T15:21:32Z,"Urea prices spike on sudden Indian demand, low stocks"
2025-08-28T15:15:34Z,Groww secures Sebi nod for up to $1 billion IPO amid headwinds in retail trading
2025-08-28T15:15:14Z,Economic Optimism Boosts Stocks
2025-08-28T15:12:55Z,Soars 38% on Strong Earnings
2025-08-28T15:12:45Z,Russia's Economy Poised to Grow Slower Than Even Tepid Estimates
2025-08-28T15:12:42Z,White House Weighs Immigration Operations at Base Near Chicago
2025-08-28T15:12:38Z,"Study of 67,000 Job Interviews Finds AI Outperforms Human Recruiters"
2025-08-28T15:12:33Z,Altice Says It's Weighing a Bid for Israel's Hot Telecom Unit
2025-08-28T15:12:25Z,Saving Money is Not a Wealth-Building Strategy's: Billionaire Grant Cardone Warns Don'st Let Cash Sit Idle or Inflation Will Eat It
2025-08-28T15:12:24Z,"US deportation flights hit record highs as carriers try to hide the planes, advocates say"
2025-08-28T15:12:23Z,Natixis-parent BPCE sells first European defence bond
2025-08-28T15:12:16Z,Chipotle Mexican Grill Stock Outlook: Is Wall Street Bullish or Bearish?
2025-08-28T15:01:48Z,US Welcomes European Plan to Impose Iran Snapback Sanctions
2025-08-28T15:01:46Z,Union Leads in Vote at Ford Battery Plant
2025-08-28T15:01:43Z,China AI Chip Leader Warns of Trading Risks After Stock Frenzy
2025-08-28T15:01:37Z,Sterling rises against weakening dollar as traders focus on Fed/Trump
2025-08-28T15:01:36Z,Trump Says Considering Staging Midterm Republican Convention
2025-08-28T15:01:34Z,Desjardins Buys Guardian to Create $203 Billion Canada Fund Manager
2025-08-28T15:01:29Z,Tariffs Squeeze Trump-Loving Farmers as Fertilizer Prices Soar
2025-08-28T15:01:26Z,Kim Harvey named executive producer of 'CBS Evening News'
2025-08-28T15:01:22Z,"As AI Makes Hiring A 'Cat And Mouse Game,' Enterprising Candidates Are Going Retro"
2025-08-28T15:01:12Z,Snowflake Stock Scores a New Street-High Price Target After Beat & Raise Earnings
2025-08-28T15:01:11Z,"AI adoption linked to 13% decline in jobs for young U.S. workers, Stanford study reveals"
2025-08-28T15:01:10Z,Sumitomo Rubber to buy US startup that predicts auto repair needs with AI
2025-08-28T14:50:29Z,Trump's Fed Feud Spotlights Mortgage Data Privacy: Is Your Information Public?
2025-08-28T14:50:29Z,Capricorn Metals commences Karlawinda expansion in Western Australia
2025-08-28T14:50:14Z,"Hedge funds in Europe gain favour as investors steer away from US, says BNP Paribas"
2025-08-28T14:50:04Z,"Dear Total Return Investors, Watch This Stock"
2025-08-28T14:50:03Z,Nvidia Is Riding the AI Revolution. What the Chip Maker Isn'st Telling Us
2025-08-28T14:48:14Z,Who is Dinesh Patnaik? India's new High Commissioner to Canada
2025-08-28T14:39:43Z,Pop Mart's New Mini Labubu Doll Sells Out Instantly in China
2025-08-28T14:39:34Z,Sweden Seeks Election-Year Spending Boost as Economy Idles
2025-08-28T14:39:26Z,Garell Exits JPMorgan After 23 Years for Leveraged Finance Rival
2025-08-28T14:39:23Z,Boeing CEO Has Revived the Stock in His First Year. There's More Work to Do
2025-08-28T14:39:22Z,US GDP growth jumps higher than expected in second estimate
2025-08-28T14:39:22Z,US Stocks Waver as Wall Street Weighs Nvidia's Tepid Outlook
2025-08-28T14:39:15Z,Nvidia is biggest blue-chip drag as Dow industrials turn negative live updates
2025-08-28T14:39:09Z,1 Reason I'm Watching Occidental Petroleum Stock in 2025
2025-08-28T14:39:03Z,"Hedge funds in Europe gain favour as investors steer away from US, says BNP Paribas"
2025-08-28T14:38:57Z,Dollar Slips on Yuan Strength and Concern Over Fed Independence
2025-08-28T14:28:20Z,Stellantis extends reduced hours scheme at historic Italian Turin plant
2025-08-28T14:28:19Z,Sierra Club Received Sex Harassment Complaint About Then-Chief Earlier This Year
2025-08-28T14:28:11Z,Trade War Pushes Canada's Current Account Deficit to Record
2025-08-28T14:28:11Z,This Struggling Food Stock Is Today's Worst in S&P 500. Why It's Raising Prices
2025-08-28T14:28:08Z,Heated standoff between police and neighbors shows unease to Trump's law enforcement surge
2025-08-28T14:28:05Z,Stocks Supported by Signs the US Economy is Holding Up
2025-08-28T14:28:04Z,General Catalyst's Hemant Taneja: AI investors are navigating speak ambiguity's
2025-08-28T14:28:03Z,UCLA's White House Talks Snarled in Newsom's Fight with Trump
2025-08-28T14:27:59Z,Top pro-Kurdish lawmakers urge faster steps in Turkey's PKK peace plan
2025-08-28T14:27:56Z,Incorta feeds your AI models directly from your ERP
2025-08-28T14:27:53Z,US pending home sales ease in July
2025-08-28T14:22:56Z,Etailers intensify festive hiring; Indian GenAI's talent crisis
2025-08-28T14:17:31Z,US Typhon missile system to temporarily deploy to Japan as part of exercise
2025-08-28T14:17:28Z,Wineries and Whiskey Makers Tap Private Credit for Financing
2025-08-28T14:17:28Z,Trump Pick Miran Is on Track for Confirmation Before Fed Meeting
2025-08-28T14:17:21Z,The $100 Caviar Chicken Nugget Ushers In a New Era at the US Open
2025-08-28T14:17:21Z,US Pending Home Sales Fall Again on Affordability Constraints
2025-08-28T14:17:20Z,"Taco Bell Brings Back Chili Cheese Burritos, Cool Ranch Doritos Locos Tacos and More Discontinued Menu Items from the 2000s"
2025-08-28T14:17:15Z,"Portuguese airline TAP's profit slides, hit by competition and bottlenecks"
2025-08-28T14:17:12Z,Emma Stone stars in dark comedy in new Venice tie-up with Lanthimos
2025-08-28T14:17:11Z,Indian professional services company SARC forays into US market
2025-08-28T14:17:08Z,"Pure Storage Stock Rallies 24%. A Meta Deal Has Something to Do With It, Say Analysts"
2025-08-28T14:17:03Z,Sweden to Scrap Uranium Mining Ban With Nuclear Buildout Looming
2025-08-28T14:14:08Z,Stocks Supported by Signs the US Economy is Holding Up
2025-08-29T22:13:00Z,Appeals court finds Trump's sweeping tariffs unconstitutional
2025-08-29T22:06:07Z,News Roundup: Online Shopping Hits Roadblock; GDP Bounces Back
2025-08-29T22:04:33Z,Appeals court finds sweeping Trump tariffs unconstitutional
2025-08-29T22:02:04Z,"Trump's tariff push overstepped presidential powers, appeals court says"
2025-08-29T21:02:01Z,"India salt workers pay brutal health cost to season national, world diets"
2025-08-29T20:34:22Z,Stocks Settle Lower as Tech Shares Selloff
2025-08-29T19:12:39Z,What in the World?
2025-08-29T18:12:51Z,Trump's 50% tariffs on India could make your everyday shopping way more expensive - here's how it will impact
2025-08-29T17:48:57Z,Will The End Of Fed Independence Crash The Market?
2025-08-29T17:37:03Z,"China Market Update: Alibaba Takes One Small Step For E-Commerce & One Giant Leap Forward On AI + Cloud, Week In Review"
2025-08-29T17:29:32Z,"Reliance bets on Jio IPO, FMCG push and AI; markets signal caution"
2025-08-29T16:25:41Z,If China is copying us: Video of fake Sujata food processors in Chinese factory goes viral
2025-08-29T16:14:48Z,Alstom secures contract for Mumbai Metro Line 4 in India
2025-08-29T15:51:20Z,Corporate bond market is taking off and needs support
2025-08-29T15:43:32Z,A comprehensive list of 2025 tech layoffs | TechCrunch
2025-08-29T15:39:54Z,"India's office market demand hits 34.5 mn sq. ft. in H1 2025, vacancies fall despite fresh supply"
2025-08-29T15:27:05Z,Events Face New Customs Headache: End of $800 Duty-Free Import Rule
2025-08-29T14:45:45Z,India allocates 5 lakh tonnes of rice and wheat each to be sold under 's Bharat's brand
2025-08-29T14:36:49Z,CG Semi to launch nation's first 's Made in India's semiconductor chip 's Here's all you need to know about the firm
2025-08-29T14:15:03Z,Real Estate Investment Trust on the road of recovery
2025-08-29T14:08:27Z,Stocks Decline on Weakness in Tech Stocks and Sticky Inflation Pressures
2025-08-29T14:00:00Z,Evaluation of methods for the measurement of antibody-dependent enhancement of dengue virus infection using different FciRIIa expressing cell lines
2025-08-29T13:37:01Z,Logistics and warehousing companies gear up for a robust festive season
2025-08-29T13:33:17Z,Reliance's AI push; CG Power chairman Vellayan Subbiah interview
2025-08-29T11:57:54Z,"LIC pays Rs 7,324 cr to Finance Minister as dividend for FY25"
2025-08-29T11:46:35Z,Oyo secures board nod to file for IPO with stronger financial outlook: Sources
2025-08-29T11:30:03Z,ABB India wins Rs 173.5 crore order from Siemens Gamesa Renewable Power
2025-08-29T11:30:00Z,A Terrible Week for Pumpkin Spice
2025-08-29T11:17:09Z,"Ola rallies 10% this week on PLI certification, even as market share dips"
2025-08-29T11:15:00Z,Bitcoin Volatility Comes Alive Ahead of PCE Inflation Data: Crypto Daybook Americas
2025-08-29T10:54:43Z,"Fine Organic, PCBL, Vinati Organics Are PL Capital's Top Picks In Chemical Sector - Check Target Price"
2025-08-29T10:42:07Z,"India's economy unexpectedly picks up steam, but Trump's tariff effect looms"
2025-08-29T10:15:00Z,UTStarcom Reports Unaudited Financial Results for First Half of 2025
2025-08-29T10:09:15Z,40 Unique Bars And Restaurants Around The World That Took Creativity To The Next Level
2025-08-29T09:58:39Z,Milind Karmarkar on Trent stock: A 10x growth story in the making
2025-08-29T09:41:02Z,Bank Nifty's oversold zone could trigger sharp pullback: Nilesh Jain
2025-08-29T09:40:36Z,"Oil India unit plans $565 million debut bond issue, bankers say"
2025-08-29T09:37:30Z,"Oil India unit plans $565 million debut bond issue, bankers say"
2025-08-29T09:28:43Z,Reliance Jio IPO announced: 5 things investors need to watch out for
2025-08-29T09:15:09Z,"India Holds Informal US Talks, Ruling Out Retaliation for Now"
2025-08-29T09:00:59Z,Buy Or Fear HSBC Stock?
2025-08-29T08:56:17Z,"Reliance AGM 2025: Jio crosses 500 million customers, aims IPO by H1FY27, Mukesh Ambani says"
2025-08-29T08:56:07Z,Can quick commerce supercharge Flipkart's Big Billion Days sales?
2025-08-29T08:48:58Z,"Quantbot Technologies LP Buys Shares of 2,029 MakeMyTrip Limited $MMYT"
2025-08-29T08:44:19Z,The Trade Desk Shareholders Will Vote Whether CEO Jeff Green Should Keep Supervoting Shares
2025-08-29T08:30:56Z,"Wellington Management Group LLP Raises Stock Position in Paychex, Inc. $PAYX"
2025-08-29T08:23:59Z,"How Reliance Industries shares are performing on AGM day. Should you buy, sell or hold?"
2025-08-29T07:57:05Z,Letter from Nikkei Asia's editor: Modi heads east as India strengthens power
2025-08-29T07:55:43Z,CW Advisors LLC Decreases Stock Position in MakeMyTrip Limited $MMYT
2025-08-29T07:55:40Z,"CW Advisors LLC Makes New $286,000 Investment in Intercontinental Exchange Inc. $ICE"
2025-08-29T07:46:23Z,"September festivals: From Ganesh Visarjan to Onam, check full list"
2025-08-29T07:40:43Z,Raamdeo Agrawal sees long-term opportunities as India enters new growth cycle
2025-08-29T07:34:46Z,China's $1.3 Trillion Stock Surge Intensifies Debate on Outlook
2025-08-29T07:33:11Z,"Sensex, Nifty 50 trade with marginal gains led by FMCG stocks, RIL shares flat ahead of AGM"
2025-08-29T07:25:33Z,"Outward remittances dip 8% to $2.13 bn in June, overseas investments surge 98%"
2025-08-29T07:17:21Z,RBI sells $3.6 billion in June to manage rupee depreciation
2025-08-29T07:14:55Z,"Charles Schwab Investment Management Inc. Sells 14,953 Shares of Integral Ad Science Holding Corp. $IAS"
2025-08-29T07:12:54Z,Is Mastercard Stock Outperforming the Nasdaq?
2025-08-29T07:12:35Z,Costco Wholesale Stock: Is COST Outperforming the Consumer Staples Sector?
2025-08-29T07:01:31Z,Is UnitedHealth Stock Underperforming the S&P 500?
2025-08-29T07:01:28Z,Kyvistar Brings Ukraine to the Nasdaq. It's a Play Now and After the War
2025-08-29T06:58:49Z,Fairfax India (OTCMKTS:FFXDF) Shares Down 0.7% 's Here's What Happened
2025-08-29T06:50:49Z,"Analysts Set Air Products and Chemicals, Inc. (NYSE:APD) PT at $335.07"
2025-08-29T06:38:57Z,"Forget China, Nvidia Is Still Poised for a Blockbuster Year. And the Stock Remains Cheap"
2025-08-29T06:38:56Z,WNS (NYSE:WNS) versus Primech (NASDAQ:PMEC) Head-To-Head Review
2025-08-29T06:35:03Z,"Critical Survey: Hon Hai Precision Industry Co., Ltd. Sponsored GDR (OTCMKTS:HNHPF) & Bel Fuse (NASDAQ:BELFB)"
2025-08-29T06:32:04Z,Indian jewellers stock up for festive season; activity muted elsewhere in Asia
2025-08-29T06:30:01Z,CNBC Daily Open: Main Street and Wall Street are still alive and kicking despite tariff uncertainties
