Date,Title
02-07-2025 03:15,"NIFTY NEXT 50 Index Live , 02 July 2025 : Historical performance overview of Nifty Next 50"
02-07-2025 09:00,"Nifty prediction todayas July 02 , 2025 : Supports coming up . Go long on dips"
04-07-2025 10:00,"SEBI bans Jane Street : REVEALED ! List of Nifty 50 , Bank Nifty stocks that US brokerage targeted"
02-07-2025 03:30,"Nifty 50 , Sensex today : What to expect from Indian stock market in trade on July 2"
03-07-2025 08:30,"Israel - Iran ceasefire : Is it right time to book profit in gold and invest in Nifty 50 , Sensex - listed stocks ? "
04-07-2025 09:30,"Nifty Prediction Todayas July 04 , 2025 : Support holds but the bounce lacks strength . Stay out . "
03-07-2025 11:00,"Sensex falls 170 points , Nifty 50 settles at 25 , 405 10 key highlights from Indian stock market today"
03-07-2025 12:00,"Technical View : As momentum seems to fade in Nifty , further consolidation with negative bias cant be ruled out"
04-07-2025 06:30,Why is the Indian stock market trading rangebound ? India - US trade deal to Q1 results 2025 explained with 5 key reasons
02-07-2025 06:30,Stocks Surged updates : Sensex falls ! But these stocks are up over 5 % on BSE
04-07-2025 05:00,HDFC Bank deposit growth outpaces loans in first quarter - The Hindu BusinessLine
02-07-2025 11:45,Does MACD Work in India ? 25 - Year Backtest on Nifty Indices
03-07-2025 04:00,Buy or sell : Vaishali Parekh recommends three stocks to buy today 3 July 2025
02-07-2025 08:00,Divis Labs to JSW Steel - Jay Thakkar suggests three stocks to buy for short - term in F & O segment
04-07-2025 06:00,Jane Street Banned From India After Market Regulator Alleges  Intra - Day Index Manipulation  
04-07-2025 00:30,"How Balrampur Chini , EID Parry are stirring up gains amid melting sugar stocks"
04-07-2025 03:00,Jane Street barred from Indian markets as regulator freezes $566 million over Nifty 50 manipulation claims
03-07-2025 04:00,Stocks to buy undera‚100 : Experts recommend three shares to buy today 3 July 2025
04-07-2025 04:00,Stocks to buy undera‚100 : Experts recommend three shares to buy today 4 July 2025
02-07-2025 03:15,"NIFTY BANK Index Live , 02 July 2025 : Review of weekly , monthly and yearly historical performance of Nifty Bank"
02-07-2025 03:15,"NIFTY MIDCAP 150 Index Live , 02 July 2025 : Weekly , monthly and yearly historical performance of Nifty Midcap 150"
05-07-2025 16:45,F & O Tracker : Index Futures May Regain Ground - The Hindu BusinessLine
04-07-2025 04:30,"Nifty 50 , Sensex likely to continue range - bound trade ; check key levels to track on July 4"
04-07-2025 01:00,Best stock recommendations today : MarketSmith India top picks for 4 July
02-07-2025 03:00,"Nifty , Sensex likely to open flat as rangebound trade continues ; key levels to track on July 2"
05-07-2025 04:00,Indian stock market : Experts unveil this strategy as 90 - day pause in Trump tariff deadline approaches
02-07-2025 05:15,"Pune E - Stock Share Price , Pune E - Stock Stock Price , Pune E - Stock Broking Ltd . Stock Price , Share Price , Live BSE / NSE , Pune E - Stock Broking Ltd . Bids Offers . Buy / Sell Pune E - Stock Broking Ltd . news & tips , & F & O Quotes , NSE ..."
03-07-2025 05:15,"Abha Power Share Price , Abha Power Stock Price , Abha Power and Steel Ltd . Stock Price , Share Price , Live BSE / NSE , Abha Power and Steel Ltd . Bids Offers . Buy / Sell Abha Power and Steel Ltd . news & tips , & F & O Quotes , NSE / BSE Forecast..."
04-07-2025 04:30,"Neetu Yoshi Share Price , Neetu Yoshi Stock Price , Neetu Yoshi Ltd . Stock Price , Share Price , Live BSE / NSE , Neetu Yoshi Ltd . Bids Offers . Buy / Sell Neetu Yoshi Ltd . news & tips , & F & O Quotes , NSE / BSE Forecast News and Live Quotes"
04-07-2025 04:30,"Adcounty Media Share Price , Adcounty Media Stock Price , Adcounty Media India Ltd . Stock Price , Share Price , Live BSE / NSE , Adcounty Media India Ltd . Bids Offers . Buy / Sell Adcounty Media India Ltd . news & tips , & F & O Quotes , NSE / BSE ..."
05-07-2025 03:30,"Mufin Green Share Price , Mufin Green Stock Price , Mufin Green Finance Ltd . Stock Price , Share Price , Live BSE / NSE , Mufin Green Finance Ltd . Bids Offers . Buy / Sell Mufin Green Finance Ltd . news & tips , & F & O Quotes , NSE / BSE Forecast ..."
03-07-2025 04:15,"Markets positive : Nifty above 25 , 500 , Sensex rises 130 points"
02-07-2025 04:30,India equity benchmarks inch higher at the open after Trump comment on trade deal
04-07-2025 04:30,"Indian shares open flat as Jane Street ban , trade deal caution weigh"
03-07-2025 04:45,Indian shares inch higher at the open on trade deal optimism
03-07-2025 04:00,Stock market today : Trade setup for Nifty 50 to global markets ; Five stocks to buy or sell Thursday 3 July 2025
04-07-2025 01:45,"Day Trading Guide for July 4 , 2025 : Intraday supports , resistances for Nifty50 stocks"
02-07-2025 18:15,"Trading Plan : Can Nifty 50 hold 25 , 400 , Bank Nifty find support at 56 , 800 ? "
04-07-2025 04:00,Stock market today : Trade setup for Nifty 50 to global markets ; Eight stocks to buy or sell Friday 4 July 2025
05-07-2025 04:00,Buy or sell : Sumeet Bagadia recommends three stocks to buy on Monday - 7 July 2025
04-07-2025 04:30,Jane Street barred from Indian markets as regulator freezes $566 million over Nifty 50 manipulation claims
03-07-2025 03:15,India equity benchmarks to open higher as investors focus on trade deals
02-07-2025 17:30,Trade setup for July 3 : Top 15 things to know before the opening bell
04-07-2025 05:45,Jane Street barred from Indian markets as regulator freezes $566 million over Nifty 50 manipulation claims
05-07-2025 16:45,Index Outlook : A Blip Before The Rise - The Hindu BusinessLine
04-07-2025 05:15,Jane Street barred from Indian markets as regulator freezes $566 million over Nifty 50 manipulation claims
03-07-2025 02:30,"Dalal Street likely to see another flat start , investors await Q1 earnings ; levels to track on July 3"
04-07-2025 05:00,Shares to open flat after SEBI bars Jane Street from market
02-07-2025 03:15,India equity benchmarks likely to rise after Trump comment on trade deal
03-07-2025 10:45,Indian stocks down as profit booking in financials overshadows trade deal optimism
04-07-2025 05:15,"Indian shares flat as investors weigh Jane Street ban , trade developments"
04-07-2025 03:45,Indian shares to open flat after regulator bars Jane Street from local market
02-07-2025 09:15,Indian non - bank lender HDB Financial valuation soars to $8b in trading debut
04-07-2025 04:00,"Indian stock market : 10 things that changed for market overnight - Gift Nifty , Big Beautiful Bill , to US nonfarm payrolls"
04-07-2025 05:45,Trent shares plunge 9 % on Nuvama downgrade : 3 crucial concerns now
04-07-2025 17:30,"SEBI to continue probing Jane Street trades in other indices , expiries , patterns"
04-07-2025 05:45,"Nifty , Sensex open with marginal gains , SEBI order on JS Group may impact derivative volumes : Expert"
02-07-2025 06:30,"India HDB Financial shines in trading debut , valuing non - bank lender at over $8 billion"
02-07-2025 12:00,"Financials Drag Nifty , Sensex To Closer Lower On Wednesday"
03-07-2025 05:15,"Nifty 50 Top Gainers : Asian Paints , M & M , ONGC , Tata Steel , Hindalco stocks lead today in intraday trading"
02-07-2025 05:00,"Nifty , Sensex opened with gains on Trump trade deal optimism , Q1 results in July to drive market further"
02-07-2025 07:00,"Nifty , Sensex Muted In Morning Session As Financial Stocks Weigh"
03-07-2025 10:30,"CNBC Inside India newsletter : Peaked , paused , and poised ? India market reboot at half - time"
03-07-2025 07:30,"Nifty holds above 25 , 500 on expiry day , Sensex gains over 200 points ; banking , financial stocks drag"
04-07-2025 09:45,"Indian stock market opens marginally up , Nifty above 25 , 400"
05-07-2025 04:45,Jane Street fallout : Derivatives trading volumes may be hit
03-07-2025 10:15,"Meesho files confidential draft papers fora‚¹4 , 250 cr IPO"
04-07-2025 01:00,Stocks to buy today : Trade Brains recommends two stocks for 4 July
04-07-2025 09:30,Jane Street SEBI Ban Live : Jane Street banned from Indian securities market
03-07-2025 07:00,Shrinking profit margins unwind popular  Make in India  trade in electronics
02-07-2025 03:45,India IPO market eyes $2 . 4 billion in offerings in July as confidence rebounds | Business News
03-07-2025 05:15,"Indian markets open in green , volatility will remain till US - India trade deal decisions : Experts"
03-07-2025 11:15,"Asia And Europe Markets Mixed , Dollar Near 3 - Year Lows - Global Markets Today While US Slept - SmartETFs Asia Pacific Dividend Builder ETF ( ARCA : ADIV ) "
04-07-2025 21:15,"Nifty Holds Above 25 , 400 as Indian Stock Market Opens Higher"
04-07-2025 06:45,Jane Street effect : Nuvama shares slump 7 % after Sebi order . What the connection ? 
05-07-2025 09:15,Sebi ban on Jane Street ! Uday Kotak flags 3 big concerns that plague Indian stock market
02-07-2025 06:30,Week of 27th June 2025 - FIIs flows increase 2x . Debt sees 2nd week of inflows
03-07-2025 05:15,"Sensex flat , Nifty under 25 , 500 on weekly expiry ; IT , metals outshine"
03-07-2025 02:30,"Stock Market LIVE Updates : GIFT Nifty indicates a firm start ; US , Asian markets gain"
04-07-2025 04:30,"Sensex sees flat start , Nifty hovers above 25 , 400 as volatility spikes ; IT , FMCG stocks lead"
02-07-2025 03:30,"Infosys , HCL Tech to TCS share prices : Is IT sector poised for a better H2CY25"
02-07-2025 03:30,"Gold prices today in your city : Check prices in Mumbai , Bengaluru , Chennai , Hyderabad , New Delhi and Kolkata on July 2"
04-07-2025 10:00,How Sebi crackdown on Jane Street unfolded : A 15 - month trail of scrutiny and ignored warnings
03-07-2025 05:30,"IndusInd Bank , Hero MotoCorp may exit Nifty to make way for IndiGo , Max Healthcare : Nuvama"
03-07-2025 09:00,Nifty Smallcap 250 Rises 17 . 83 % In Q1 FY26 ; Midcap 150 Up 15 % 
03-07-2025 14:30,"Sitaare Zameen Par : Gold , silver and global funds shine brighter than domestic equity stars"
03-07-2025 02:30,Beyond borders : Why global investing makes sense for Indian portfolios
03-07-2025 06:15,Markets open mixed as trade deal hopes counter FII selling pressure
02-07-2025 17:30,"Sensex , Nifty Close Lower as Investors Turn Cautious Ahead of Trump Tariff Deadline"
04-07-2025 06:45,"Nifty , Sensex open with marginal gains , SEBI order on JS Group may impact derivative volumes : Expert"
04-07-2025 23:45,"Sensex , Nifty Snap Four - Day Winning Streak as Investors Book Profits"
02-07-2025 05:00,"Nifty , Sensex opened with gains on Trump trade deal optimism , Q1 results in July to drive market further"
04-07-2025 04:30,"Stock Market LIVE Updates : Nifty 25 , 400 , Sensex flat ; Nuvama Wealth down 5 %, Marico gains 4 % "
03-07-2025 04:45,"Stock Market Live Updates 3 July 2025 : Sensex , Nifty edge up in early trade"
04-07-2025 06:30,"Indian stock market opens marginally up , Nifty above 25 , 400"
04-07-2025 10:00,Expert view : Indian stock market may hit a record high during the festive season ; pharma can be a strong contra bet
03-07-2025 10:15,Shimona Chadha Joins Persistent as Chief Marketing Officer
04-07-2025 01:00,Top three stocks to buy today recommended by Ankush Bajaj for 4 July
06-07-2025 00:30,3  Boring  Stocks to add to your watchlist - Stock Insights News
04-07-2025 13:30,"Indian markets open in green , volatility will remain till US - India trade deal decisions : Experts"
04-07-2025 17:15,Final Trade July 03 : Markets Slip Amid Volatile Expiry ; Sensex Drops 170 Ptsas The Indian Awaaz
04-07-2025 17:45,Markets This Week
10-07-2025 11:30,"Sensex , Nifty 50 extend losses to the second consecutive session 10 key highlights from Indian stock market today"
08-07-2025 10:45,"Sensex rises 270 points , Nifty 50 settles above 25 , 500 10 key highlights from Indian stock market today"
11-07-2025 03:15,"Nifty 50 , Sensex today : What to expect from Indian stock market in trade on July 11 ? "
07-07-2025 02:30,"Nifty 50 , Sensex today : What to expect from Indian stock market in trade on July 7"
08-07-2025 06:30,"Bharat Electronics , M & M to Infosysas These 28 Nifty 50 stocks are trading at rich valuations"
10-07-2025 09:00,"Nifty prediction todayas July 10 , 2025 : Support to decide the next move . Stay away . "
11-07-2025 06:30,"Nifty prediction todayas July 11 , 2025 : Breaks a crucial support . Go short"
08-07-2025 10:45,"Stock market today : 51 stocks hit 52 - week lows , 128 stocks at 52 - week high as Nifty 50 , Sensex end higher"
08-07-2025 04:45,"Stock market today : Sensex , Nifty 50 trade rangebound amid Trump tariffs uncertainty ; experts unveil this strategy"
07-07-2025 05:30,"Nifty Prediction Todayas July 07 , 2025 : Can go either way . Stay out of the market"
08-07-2025 04:15,"Markets muted as investors eye announcement on India - US trade deal ; Nifty near 25 , 400 , Sensex falls 100 points"
10-07-2025 09:15,"Nagaraj Shetti suggests PCBL Chemical , BLS International shares to buy in the short term ; do you own ? "
11-07-2025 07:15,"Sensex crashes over 700 points , Nifty 50 dips below 25 , 150 . Why is the Indian stock market falling today ? "
11-07-2025 03:15,Buy or sell : Vaishali Parekh recommends three stocks to buy today 11 July 2025
06-07-2025 07:00,Stocks to buy undera‚100 : Sumeet Bagadia recommends three shares to buy on Monday - 6 July 2025
08-07-2025 07:00,"Nifty Prediction Todayas July 08 , 2025 : Stuck in a narrow range . Stay out of the market"
11-07-2025 03:15,Stocks to buy undera‚100 : Experts recommend three shares to buy today 11 July 2025
08-07-2025 11:30,Stocks Surged updates : Sensex rises ! These stocks surged over 5 % on BSE
09-07-2025 07:45,"Q1FY26 Results Preview : Nifty 50 companies likely to post 5 % profit growth in June quarter , led by THIS sector"
07-07-2025 03:15,"Valuation froth has moderated after market correction , good reason to bet on high - growth and high - quality mid - cap stocks , per Sundaram Alternate Assets MD"
12-07-2025 04:45,Stocks to buy undera‚¹200 : Mehul Kothari of Anand Rathi recommends three shares to buy or sell on Monday - 14 July 2025
10-07-2025 03:15,Best stock recommendations today : MarketSmith India top picks for 10 July
07-07-2025 02:30,Best stock recommendations today : MarketSmith India top picks for 7 July
07-07-2025 02:30,Buy or sell : Vaishali Parekh recommends three stocks to buy today 7 July 2025
08-07-2025 08:30,"Shares to buy in short term : Mehta Equitie Riyank suggests KRN Heat , Senco , Balaji Amines stock to buy in near term"
08-07-2025 07:45,"Globe Civil Pro Share Price , Globe Civil Pro Stock Price , Globe Civil Projects Ltd . Stock Price , Share Price , Live BSE / NSE , Globe Civil Projects Ltd . Bids Offers . Buy / Sell Globe Civil Projects Ltd . news & tips , & F & O Quotes , NSE / BS..."
10-07-2025 03:15,Stocks to buy undera‚100 : Experts recommend three shares to buy today 10 July 2025
10-07-2025 09:15,"Sacheerome Share Price , Sacheerome Stock Price , Sacheerome Ltd . Stock Price , Share Price , Live BSE / NSE , Sacheerome Ltd . Bids Offers . Buy / Sell Sacheerome Ltd . news & tips , & F & O Quotes , NSE / BSE Forecast News and Live Quotes"
10-07-2025 05:45,"Tata Group Stocks - List of Tata Stocks in India , Live Stock Price , Top Gainers , Losers"
12-07-2025 14:15,"Nifty closing above 25 , 330 could reignite bullish momentum : Experts"
08-07-2025 11:15,"Top gainers & losers 8th July 2025 : Sensex , Nifty 50 flat , Kotak , Trent , BSE , JP Power , PC Jeweller & more stocks in action"
10-07-2025 09:00,"Top gainers & losers today 10th July : Sensex , Nifty 50 fall ahead of TCS Q1 results ; Wipro , Tech Mahindra & Infosys among top losers"
07-07-2025 05:30,"Market Opening Bell : Sensex opens in red , Nifty holds 25 , 450 , FMCG stocks in action"
08-07-2025 16:45,Markets trade rangebound amid uncertainty over India - US trade deal
08-07-2025 10:45,"Top Gainers and Losers on July 08 : Alok Industries , KPR Mill , Waaree Energies , NHPC among top gainers today"
11-07-2025 06:30,Options premium trading hits 4 - month low after Jane Street ban
08-07-2025 03:30,"Lake Shore Real Share Price , Lake Shore Real Stock Price , Lake Shore Realty Ltd . Stock Price , Share Price , Live BSE / NSE , Lake Shore Realty Ltd . Bids Offers . Buy / Sell Lake Shore Realty Ltd . news & tips , & F & O Quotes , NSE / BSE Forecas..."
08-07-2025 07:45,"Retaggio Ind Share Price , Retaggio Ind Stock Price , Retaggio Industries Ltd . Stock Price , Share Price , Live BSE / NSE , Retaggio Industries Ltd . Bids Offers . Buy / Sell Retaggio Industries Ltd . news & tips , & F & O Quotes , NSE / BSE Forecas..."
10-07-2025 02:15,"Julien Agro Inf Share Price , Julien Agro Inf Stock Price , Julien Agro Infratech Ltd . Stock Price , Share Price , Live BSE / NSE , Julien Agro Infratech Ltd . Bids Offers . Buy / Sell Julien Agro Infratech Ltd . news & tips , & F & O Quotes , NSE /..."
11-07-2025 09:30,"Abram Food Share Price , Abram Food Stock Price , Abram Food Ltd . Stock Price , Share Price , Live BSE / NSE , Abram Food Ltd . Bids Offers . Buy / Sell Abram Food Ltd . news & tips , & F & O Quotes , NSE / BSE Forecast News and Live Quotes"
11-07-2025 09:45,"Rama Telecom Share Price , Rama Telecom Stock Price , Rama Telecom Ltd . Stock Price , Share Price , Live BSE / NSE , Rama Telecom Ltd . Bids Offers . Buy / Sell Rama Telecom Ltd . news & tips , & F & O Quotes , NSE / BSE Forecast News and Live Quote..."
10-07-2025 10:00,Can Q1 results drive Nifty 50 to record highs despite the absence of an India - US trade deal ? 
09-07-2025 08:30,"Top gainers & losers today on NSE , BSE : Sensex , Nifty 50 flat , Metal stocks Vedanta , Hindustan Zinc , Tata Steel drag , Crizac jumps 9 % "
08-07-2025 12:30,Stocks Surged : Sensex rises ! These stocks gained over 10 % on BSE
08-07-2025 07:45,"3C IT Solutions Share Price , 3C IT Solutions Stock Price , 3C IT Solutions & Telecom India Ltd . Stock Price , Share Price , Live BSE / NSE , 3C IT Solutions & Telecom India Ltd . Bids Offers . Buy / Sell 3C IT Solutions & Telecom India Ltd . news &..."
10-07-2025 02:15,"LMW Share Price , LMW Stock Price , LMW Ltd . Stock Price , Share Price , Live BSE / NSE , LMW Ltd . Bids Offers . Buy / Sell LMW Ltd . news & tips , & F & O Quotes , NSE / BSE Forecast News and Live Quotes"
09-07-2025 02:30,"Indian stock market : 8 key things that changed for market overnight - Gift Nifty , Trump tariffs , to copper prices"
10-07-2025 04:30,India equity benchmarks open flat as IT offsets broader gains
11-07-2025 05:00,"Indian equity benchmarks open lower , dragged down by IT stocks"
11-07-2025 09:15,"Top gainers & losers today 11th July 2025 : Sensex , Nifty 50 trade lower on IT drag , Glenmark Pharma , HUL , TCS and more in action"
09-07-2025 04:15,Indian stock benchmarks open flat after Trump threatens pharma tariffs
09-07-2025 08:30,"Bulls and bears stay on sidelines as Nifty , Sensex struggle for direction , volatility cools"
08-07-2025 04:15,India stock benchmarks off to a muted start on tariff jitters ; Trump says India deal close
08-07-2025 02:15,"Day Trading Guide for July 8 , 2025 : Intraday supports , resistances for Nifty50 stocks"
11-07-2025 03:00,"Day Trading Guide for July 11 , 2025 : Intraday supports , resistances for Nifty50 stocks"
08-07-2025 01:45,Nifty 50 Q1 earnings : Nifty 50 companies to see 4 . 6 % net profit growth amid mixed sector performance
10-07-2025 03:15,"Indian stock market : 8 key things that changed for market overnight - Gift Nifty , Trump tariffs , to Fed minutes"
07-07-2025 09:30,"Sensex , Nifty trade flat as investors stay cautious ahead of US - India tariff deadline"
11-07-2025 03:15,"Trading Plan : Can bears drag Nifty 50 toward 25 , 200 , Bank Nifty near previous week low ? "
11-07-2025 04:00,"Nifty 50 companies grew only 3 . 5 % last quarter , next 450 companies grew over 20 %: Alok Agarwal"
11-07-2025 04:15,"Nifty 50 companies grew only 3 . 5 % last quarter , next 450 companies grew over 20 %: Alok Agarwal"
08-07-2025 07:15,"Infosys shares among top gainers on Nifty 50 , rise 0 . 34 % "
09-07-2025 11:15,How to park Rs 60 lakh for safe Rs 10 20k monthly income post retirement
07-07-2025 08:45,"Nifty , Sensex open flat ; tariff deadline may extend to August"
11-07-2025 17:30,Glenmark Pharma soars 10 % to record high on AbbVie cancer treatment licensing deal
09-07-2025 16:30,"Equity mutual fund inflows rise 24 % to Rs 23 , 587 cr in June : AMFI"
10-07-2025 16:45,Sensex Nifty fall as IT stocks drag amid profit booking
09-07-2025 04:45,"From Laurus Labs , Lupin to Biocon Pharma stocks rise up to 3 % despite Trump 200 % tariff threat"
09-07-2025 10:30,Rupee slips as trade worries keep Asia FX on the defensive - The Hindu BusinessLine
07-07-2025 03:00,India stock benchmarks to open flat on caution ahead of US tariff deadline
09-07-2025 07:00,Rupee slips as trade worries keep Asia FX on the defensive
11-07-2025 07:30,"Indian stock market over - reliant on IT stocks ? TCS , Infosys , and others push Sensex down 700 points , Nifty down 200 points"
07-07-2025 08:00,"Indian stock market : Sensex , Nifty 50 remain volatile ahead of trade deal uncertainty . Key technical levels to watch out"
08-07-2025 06:30,"Asian Stocks Climb Despite Trump Tariff Threats , Eyes on RBA Rate Cut"
11-07-2025 07:45,Asian Markets Mixed as Trump Tariff Fears Offset China Stimulus Hopes
10-07-2025 09:15,Want to create wealth in long term ? Passive investing might be the answer
06-07-2025 17:45,Trade setup for July 7 : Top 15 things to know before the opening bell
08-07-2025 17:30,Trade setup for July 9 : Top 15 things to know before the opening bells
11-07-2025 03:15,Trade setup for July 11 : Top 15 things to know before the opening bells
07-07-2025 02:30,Stocks to buy today : Trade Brains Portal recommends two stocks for 7 July
09-07-2025 02:30,"Stock market today : Trade setup for Nifty 50 , Trump tariffs to global markets ; Eight stocks to buy or sell on Wednesday"
08-07-2025 12:30,US stock futures steady as markets look to rebound from Trump tariff jitters
09-07-2025 14:30,FIIs net buy shares worth Rs 77 crore while DIIs net bought Rs 920 crore - worth shares on July 9
06-07-2025 12:00,"Dalal Street This Week : From U . S Tariff Deadline To Q1 Earnings , Here Are Few Factors That Will Keep Investors Busy This Week"
07-07-2025 05:30,"Rupee weighed down by weak Asia FX , interbank dollar bids"
07-07-2025 05:30,Indian shares muted as consumer stocks offset broader losses amid tariff uncertainty
08-07-2025 11:00,Financials lead Indian equity benchmarks higher ; tariff jitters cap gains
09-07-2025 10:30,"Rupee , forward premiums tread water with Fed minutes and tariffs in focus"
12-07-2025 03:15,"Chartist Talks : I - Sec Dharmesh Shah sees strong Nifty structure despite recent correction ; expects index to reach 25 , 800 in August"
07-07-2025 02:30,"Indian stock market : 8 things that changed for market over weekend - Gift Nifty , Trump tariffs to US - India trade talks"
11-07-2025 03:15,Stock market today : Trade setup for Nifty 50 to global markets ; Eight stocks to buy or sell on Friday 11 July 2025
09-07-2025 03:00,"Nifty , Sensex likely to see further consolidation , pharma in focus ; key levels to watch on July 9"
08-07-2025 03:00,Indian shares to open muted on tariff jitters ; Trump says India deal close
09-07-2025 08:15,"India mutual fund investors chase equities , gold and silver in quest for returns"
10-07-2025 10:45,India benchmarks slip on IT drag ahead of TCS earnings
10-07-2025 02:45,"Indian shares set for higher open on trade , earnings optimism"
06-07-2025 08:30,Jane Street case : Shankar Sharma raises concerns over exchange oversight
09-07-2025 11:45,Bank stocks vs NBFC stocks : Look who racing ahead in rate cut cycle
07-07-2025 05:30,Indian shares muted as consumer stocks offset broader losses amid tariff uncertainty
10-07-2025 09:00,Indian IPOs set to raise up to $18 billion in second - half surge
09-07-2025 03:15,Indian stock benchmarks set to open flat as Trump threatens pharma tariffs
13-07-2025 00:45,"Nifty closing above 25 , 330 could reignite bullish momentum : Experts"
11-07-2025 04:15,Stock market today : Nifty50 opens in red ; BSE Sensex down over 250 points
07-07-2025 03:45,"Stock Market LIVE Updates : GIFT Nifty suggests a muted start ; Dhanlaxmi Bank , Kalyan Jewellers , RVNL , Bocon in focus"
12-07-2025 12:15,"Nifty closing above 25 , 330 could reignite bullish momentum : Experts"
07-07-2025 03:45,"Sensex , Nifty set for subdued start to the week ; key levels to track on July 7"
09-07-2025 12:45,MF equity inflows jump 24 per cent in June despite market volatility
07-07-2025 05:30,"Weekly Musingsas Index performance for week ended July 04 , 2025"
12-07-2025 07:15,BEML share price to be in focus as board to consider stock split
10-07-2025 03:00,"From TCS , Bharti Airtel to Waaree Energiesas Here are 8 stocks to watch"
11-07-2025 09:15,"Sensex falls over 600 pts , Nifty below 25 , 200 as trade worries hit IT , auto stocks"
10-07-2025 05:30,"Nifty , Sensex open in green as investor focus shifts to Q1 earnings amid trade deal delay"
07-07-2025 02:30,Stock market today : Trade setup for Nifty 50 to global markets ; Eight stocks to buy or sell Monday 7 July 2025
09-07-2025 02:30,Stocks to buy today : Trade Brains Portal recommends two stocks for 9 July
10-07-2025 03:15,"Stock market today : Trade setup for Nifty 50 , Trump tariffs to global markets ; Eight stocks to buy or sell on Thursday"
12-07-2025 04:45,Buy or sell : Sumeet Bagadia recommends three stocks to buy on Monday - 14 July 2025
11-07-2025 01:30,"Morgan Stanley : Morgan Stanley sees up to 22 % upside in PFC , REC"
10-07-2025 14:30,"Sensex , Nifty end on negative note as IT stocks drag ; markets see selling at higher levels"
10-07-2025 03:15,Stocks to buy today : Trade Brains Portal recommends two stocks for 10 July
13-07-2025 00:15,"HUL gets first woman CEO , but India Inc still far from gender parity at the top"
