Date,Title
15-08-2025 03:15,"Independence Day stock picks : BEL , PFC to Hero Motocorp - SMC expert recommends THESE 11 stocks to buy"
13-08-2025 22:45,"Indian stock market settles high , Sensex jumps 304 pts"
11-08-2025 17:15,"Q1 Results Highlights : BEML Q1 loss declines , Awfis Space , Ipca Lab & JM Financial profit rise , SJVN profit declines , DEE Development logsa‚13 cr Q1 profit , Bata , Titagarh Rail Q1 results today"
14-08-2025 02:45,Indian Stock Market Closes Higher on Record - Low Inflation Data ; Sensex Gains 304 Points
13-08-2025 12:00,"Indian stock market settles high on lower inflation data , Sensex jumps 304 points"
11-08-2025 15:00,"Aug 11 , 2025 : Indian stock market soars amid FII return , Sensex surges 746 points"
20-08-2025 10:45,"Stock market today : 53 stocks hit 52 - week lows , 142 stocks at 52 - week high as Nifty 50 , Sensex end in green"
19-08-2025 02:45,"Nifty 50 , Sensex today : What to expect from Indian stock market in trade on August 19 after Trump - Zelensky meeting"
20-08-2025 03:30,"Nifty 50 , Sensex today : What to expect from Indian stock market in trade on August 20"
18-08-2025 04:00,"Nifty 50 , Sensex today : What to expect from Indian stock market in trade on August 18 after Trump - Putin meeting"
20-08-2025 14:00,"Nifty 50 reclaims 25 , 000 after nearly a month : Can bulls drive the index to 25 , 250 ? "
22-08-2025 03:15,"Nifty 50 , Sensex today : What to expect from Indian stock market in trade on August 22"
18-08-2025 10:00,"GST reforms hopes , S & P upgrade lift Sensex , Nifty 50 : Which sectors to invest in and how far can the rally go ? Explained"
22-08-2025 16:30,"NSE Nifty 50 Reshuffle : Max Healthcare , InterGlobe Aviation in ; IndusInd Bank , Hero out"
20-08-2025 10:45,"Sensex rises 200 points , Nifty ends at 25 , 050 10 key highlights from the Indian stock market today"
19-08-2025 10:45,"Sensex , Nifty 50 rise for 4th consecutive session 10 key highlights from the Indian stock market today"
22-08-2025 11:00,"Sensex , Nifty 50 snap 6 - day gaining streak 10 key highlights from the Indian stock market today"
19-08-2025 07:15,"Nifty Prediction Todayas August 19 , 2025 : Nifty 50 Futures : Can oscillate in a range . Stay out"
18-08-2025 04:00,Shares to buy or sell : Chandan Taparia recommends three stocks to buy and sell today - 18 August 2025
20-08-2025 05:45,"Markets muted : Nifty near 24 , 900 , Sensex falls 105 points ; Nazara Tech , Delta Corp down 4 % each"
20-08-2025 06:45,"Nifty Prediction Todayas August 20 , 2025 : Nifty futures : Charting a sideways trend , wait for a breakout"
22-08-2025 03:15,Shares to buy or sell : Chandan Taparia recommends three stocks to buy and sell today - 22 August 2025
20-08-2025 11:45,"India stocks set for modest gains as US tariffs , foreign outflows cloud outlook"
17-08-2025 07:00,"Stocks to buy or sell : Dharmesh Shah of ICICI Sec suggests buying Indian Hotel , PFC shares tomorrow - 18 August 2025"
18-08-2025 11:45,"Technical View : Strong rally fuels bullish hopes , but Nifty must hold Monday low for further uptrend"
21-08-2025 01:15,Best stock recommendations today : MarketSmith India top picks for 21 August
22-08-2025 15:30,"Nifty 50 index to include Max Healthcare , InterGlobe Aviation after rejig"
17-08-2025 09:00,"India Corporate Earnings Show Broad - Based Growth In Q1 FY26 , Says Motilal Oswal"
20-08-2025 12:30,Ola Electric rockets 28 % on  India Inside  Vision : 3 game - changing moves revealed
19-08-2025 10:45,"Stock market today : 65 stocks hit 52 - week lows , 143 stocks at 52 - week high as Nifty 50 , Sensex end in green"
18-08-2025 08:00,"Finance Sector Stocks - List of Finance Stocks in India , Live Stock Price , Top Gainers , Losers"
20-08-2025 12:15,"Technical View : Five - day gaining streak help Nifty bulls clear 50 % retracement , could target 25 , 300 ; Bank Nifty disappoints"
22-08-2025 07:15,Earnings Review : These 4 Nifty 50 companies posted over 50 % increase in net profit in Q1
22-08-2025 12:30,"Technical View : Bears may tighten grip if Nifty decisively breaks 24 , 700 next week ; Bank Nifty near 100 - day EMA support"
19-08-2025 23:15,The  Ghosts of 2007  and the graybeard  Nifty 50 : BofA looks at the rare situation in markets and finds ominous parallels to the GFC and the dotcom bubble
22-08-2025 11:00,"Top Gainers & Losers on August 22 : Godfrey Philips , JK Cement , Ola , Hyundai Motor among top losers today"
22-08-2025 11:00,"Nifty under 25 , 000 , Sensex stumbles 700 points to snap six - day rally as FMCG stocks drag"
20-08-2025 03:30,"Stock market today : Trade setup for Nifty 50 , GST reforms to Trump tariffs ; eight stocks to buy or sell on Wednesday"
22-08-2025 11:00,"Taking Stock : Six - day gaining streak snaps , Nifty below 24 , 900 , Sensex down nearly 700 pts"
18-08-2025 14:00,"GST revamp , S & P ratings upgrade fuel rally in Indian equities"
17-08-2025 03:15,Stocks to buy undera‚100 : Sumeet Bagadia recommends three shares to buy on Monday - 18 August 2025
23-08-2025 04:15,Sebi CAS proposal : Sebi proposes CAS for derivative stocks to simplify pricing mechanism
18-08-2025 08:00,"Consumer Durables Sector Stocks - List of Consumer Durables Stocks in India , Live Stock Price , Top Gainers , Losers"
20-08-2025 04:30,"Sensex Today | Stock Market LIVE Updates : Sensex drops over 50 pts , Nifty below 25K ; Kotak Bank , UltraTech top laggards"
21-08-2025 01:15,"Stock market today : Trade setup for Nifty 50 , Trump tariffs to US Fed minutes ; eight stocks to buy or sell on Thursday"
19-08-2025 03:15,Can Sensex and Nifty extend gains for a fourth session ? Key levels to track on August 19
17-08-2025 03:15,Buy or sell : Ganesh Dongre of Anand Rathi recommends three stocks to buy on Monday - 18 August 2025
21-08-2025 04:00,"Shri Vasuprada Share Price , Shri Vasuprada Stock Price , Shri Vasuprada Plantations Ltd . Stock Price , Share Price , Live BSE / NSE , Shri Vasuprada Plantations Ltd . Bids Offers . Buy / Sell Shri Vasuprada Plantations Ltd . news & tips , & F & O Q..."
23-08-2025 03:00,"Emkay Tools Share Price , Emkay Tools Stock Price , Emkay Tools Ltd Ltd . Stock Price , Share Price , Live BSE / NSE , Emkay Tools Ltd Ltd . Bids Offers . Buy / Sell Emkay Tools Ltd Ltd . news & tips , & F & O Quotes , NSE / BSE Forecast News and Liv..."
23-08-2025 03:00,"Tamboli Ind . Share Price , Tamboli Ind . Stock Price , Tamboli Industries Ltd . Stock Price , Share Price , Live BSE / NSE , Tamboli Industries Ltd . Bids Offers . Buy / Sell Tamboli Industries Ltd . news & tips , & F & O Quotes , NSE / BSE Forecast..."
18-08-2025 05:00,"Sensex Today | Stock Market LIVE Updates : Sensex soars over 1 , 000 pts on GST reform boost ; Nifty tops 24 , 950 ; Auto and consumer durables stocks surge"
20-08-2025 03:30,"Day Trading Guide for August 20 , 2025 : Intraday supports , resistances for Nifty50 stocks"
18-08-2025 04:00,Best stock recommendations today : MarketSmith India top picks for 18 August
19-08-2025 03:00,"Day Trading Guide for August 19 , 2025 : Intraday supports , resistances for Nifty50 stocks"
18-08-2025 04:00,"Stock market today : Trade setup for Nifty 50 , GST reforms to Trump tariffs ; eight stocks to buy or sell on Monday"
22-08-2025 03:15,Best stock recommendations today from MarketSmith India
19-08-2025 10:45,"Top Gainers & Losers on August 19 : OLA , Hyundai Motor , Raymond , Reliance Power , Vardhman Textiles among top gainers"
22-08-2025 12:15,Beware ! Indian Inc faces biggest earnings downgrade in Asia as Trump tariff tantrum threatens growth
22-08-2025 03:15,Stocks to buy undera‚100 : Experts recommend three shares to buy today before Jerome Powell Jackson Hole speech
19-08-2025 10:15,"Tata Motors , Adani Ports among top gainers on Nifty 50"
22-08-2025 02:00,"Day Trading Guide for August 22 , 2025 : Intraday supports , resistances for Nifty50 stocks"
19-08-2025 05:45,"Nifty holds above 24 , 900 , Sensex flat as bulls take breather amid cooling volatility"
23-08-2025 04:00,Jackson Hole Symposium : What US Fed chair Jerome Powell speech means for the Indian stock market
18-08-2025 09:15,Auto stocks drive market rally as Sensex holds above 800 - point gains
21-08-2025 04:00,RailTel Corp shares in focus as it secures multiple orders worth over Rs 50 crore
19-08-2025 09:15,India trails EMs by widest margin in 15 years . Can the tide turn ? 
17-08-2025 14:30,"THESE five sectors in focus amid global uncertainties , Geojit Vinod Nair explains"
17-08-2025 18:15,Trade setup for August 18 : Top 15 things to know before the opening bells
20-08-2025 02:00,Trade setup for August 20 : Top 15 things to know before the opening bells
19-08-2025 03:15,Trade setup for August 19 : Top 15 things to know before the opening bells
19-08-2025 09:30,"GST reforms to boost stock markets ; Nifty50 could reach 28 , 000 by September 2026 : Report"
21-08-2025 04:00,Tech Mahindra shares in focus as it incorporates Saudi arm to expand footprint
21-08-2025 04:00,"Stock Market LIVE Updates : Sensex , Nifty gain at pre - open ; Clean Science , India Cements , RailTel Corp , Jupiter Wagons in focus"
22-08-2025 18:00,Market snaps six - day gaining streak amid all - round selling across sectors
19-08-2025 02:45,"Indian stock market : 8 key things that changed for market overnight - Gift Nifty , Trump - Zelensky meet to crude oil prices"
18-08-2025 04:00,Stocks to buy for short term : From HAL to UBL Jigar Patel of Anand Rathi recommends 3 shares
18-08-2025 14:45,"Indian stock markets surge as Sensex and Nifty rally , fueled by anticipated GST reforms . Sensex , Nifty , GST reform , India rating upgrade , stock market , automotive stocks , consumption stocks , banking stocks - The Week"
22-08-2025 17:45,"Markets end six - day rally as US tariff threat looms , Fed Chair Jackson Hole speech awaited"
22-08-2025 03:15,Stocks to trade today : Trade Brains Portal recommends two stocks for 22 August
18-08-2025 03:15,"Nifty likely to trade in 24 , 200as 24 , 800 range : Analysts"
18-08-2025 11:15,"Rupee ends higher alongside local equities ; premiums , volatility flat"
18-08-2025 04:00,"Stocks to watch : Vodafone Idea , KEC International , Coal India , Inox Wind among shares in focus today"
18-08-2025 02:45,"India stock benchmarks set to open higher on easing oil woes , S & P upgrade boost"
20-08-2025 02:30,"Indian stock market : 10 key things that changed for market overnight - Gift Nifty , China LPR to India - China ties"
22-08-2025 03:15,"Indian stock market : 10 key things that changed for market overnight - Gift Nifty , US PMI , jobless claims to gold prices"
23-08-2025 10:45,Buy or sell : Sumeet Bagadia recommends three stocks to buy on Monday 25 August 2025
19-08-2025 12:45,"Gold Prices Surge to $3 , 600 Amid Global Economic Shifts"
18-08-2025 10:00,"Proposed GST reform fires up Dalal Street bulls , Nifty rallies 300 points driven by auto stocks"
22-08-2025 14:45,"DIIs turn net sellers after a month , of Indian equities worth Rs 329 crore ; FIIs net sold Rs 1 , 623 crore"
18-08-2025 10:00,Penny stock undera‚¹2 : IT stock hits upper circuit after Q1 results 2025
19-08-2025 06:45,"Nifty 50 may touch 28 , 000 due to GST rationalisation ; a growth - accretive reform : Report"
18-08-2025 04:00,"Rupee to receive a risk boost , but US - India trade discord overhang persists"
17-08-2025 15:45,"Dalal Street Week Ahead : Jackson Hole Symposium , FOMC minutes , manufacturing & services PMI flash numbers among key factors to watch"
20-08-2025 11:45,"Buy These 10 Uber - Cheap  Revival Story  Stocks , BofA Says"
20-08-2025 03:30,"Stocks to watch : Bajaj Auto , HAL , Paytm , RVNL among shares in focus today"
19-08-2025 04:45,Trump - Zelensky meeting : Key takeaways that Indian stock market investors MUST know
18-08-2025 05:00,"Sensex , Nifty jump over 1 . 3 pc ; auto stocks lead rally"
21-08-2025 05:00,Rising borrowing costs raise new risks for small and mid - sized Indian firms
20-08-2025 13:30,"Indian stock benchmarks extend gains ; Sensex gains 213 points , Nifty tops 25K"
20-08-2025 09:00,"Comex gold prices projected to touch USD 3 , 600 by year - end : Report"
20-08-2025 15:45,"Comex gold prices projected to touch $3 , 600 by year - end : Report"
19-08-2025 10:30,Indian stock market benefits from long - term growth : Report
20-08-2025 01:30,mutual fund performance : How can investors accurately track and evaluate mutual fund performance ? 
18-08-2025 01:45,Corporate earnings stumble as weak demand drags growth to multi - quarter lows
18-08-2025 11:00,Infosys shares fall 0 . 82 % after change in last 1 hour
22-08-2025 01:15,U . S . tariff impact : India sees Asia biggest earnings downgrades
19-08-2025 06:15,"Nifty , Sensex open higher amid positive buzz on GST reforms"
19-08-2025 05:00,"Nifty , Sensex open flat as investors track Ukraine peace talks ; Oil , Metal and Media shares gain"
21-08-2025 18:15,Indian firms face steepest earnings cuts in Asia amid US tariff risks
20-08-2025 02:00,"Trading Plan : Can Nifty 50 , Bank Nifty extend gains for a fifth straight session ? "
21-08-2025 01:15,Best stocks to buy today : Ankush Bajaj top three recommendations for 21 August
20-08-2025 06:45,"IPO News Live Today : Gem Aromatics , Patel Retail , Vikram Solar , Shreeji Shipping enters Day 2 ; Mangal Electrical subscribed 12 % so far on opening day"
20-08-2025 04:45,"Sensex Today Live : Sensex flat , Nifty above 24 , 950 ; Nazara Tech down 5 %, Ola Electric up 7 % "
18-08-2025 01:45,"Trading Plan : Will Nifty 50 , Bank Nifty extend their upward journey this week ? "
20-08-2025 09:45,Mutual funds sell 20 lakh shares of BSE after Jane Street case in July
21-08-2025 19:45,Sammaan Capital to raise $300 million via secured social bonds
21-08-2025 02:45,"How will markets open today ? Nikkei down 0 . 5 %, GIFT Nifty flat , and 6 other cues at this hour"
20-08-2025 06:45,"Nifty , Sensex slip marginally in early trade amid mixed global cues"
22-08-2025 11:30,"As an investor , how do I diversify between FDs , corporate bonds , market linked debentures ? What the right mix ? "
22-08-2025 09:30,Indian stock market opens lower amid mixed global cues
19-08-2025 09:00,Nifty and Sensex Rise on GST Reform Optimism
19-08-2025 12:00,Equirus Report Warns of Smallcap Risks Amid India Stock Growth
21-08-2025 20:30,Indian firms face steepest earnings cuts in Asia amid US tariff risks
22-08-2025 01:30,"From Hindalco , HUL , Texmaco to Paras Defence - Here are 6 stocks to watch - Market News"
20-08-2025 05:15,"Nifty , Sensex open flat as FPI outflows weigh on sentiment despite govt boosters"
22-08-2025 03:15,Best stocks to buy today : Ankush Bajaj top three recommendations for 22 August
18-08-2025 05:00,"Investors Earn Rs 5 Lakh Crore In 5 Minutes As Stock Markets Soar - Trak . in - Indian Business of Tech , Mobile & Startups"
21-08-2025 08:15,The  Ghosts of 2007  and the graybeard  Nifty 50 : BofA looks at the rare situation in markets and finds ominous parallels to the GFC and the dotcom bubble
18-08-2025 08:30,India proposes GST rate cut on small cars as Modi reforms spur stock market
22-08-2025 07:15,Penny stock surged 10 % despite sell - off in Indian stock market ; here why
23-08-2025 06:30,Stocks to buy undera‚ 200 : Mehul Kothari of Anand Rathi recommends three shares to buy or sell
20-08-2025 02:45,"From Reliance Industries , HAL , Indian Oil to Suzlon Energy - Here are 8 stocks to watch - Market News"
21-08-2025 02:45,"From Infosys , UltraTech Cement , Vedanta to RailTel - Here are 9 stocks to watch - Market News"
19-08-2025 06:15,Nifty Sensex flat as Ukraine peace talks influence market trends
22-08-2025 03:15,"Stock market today : Trade setup for Nifty 50 , Trump tariffs to Jackson Hole Symposium ; 8 stocks to buy or sell on Friday"
22-08-2025 23:15,Indian Stock Market Opens Lower Amid Mixed Global Cues
20-08-2025 04:45,"Nifty top gainers : Bharti Airtel , Infosys stocks lead gains on Nifty 50 index today"
19-08-2025 08:30,Trump - Zelenskyy meeting : What does it mean for Trump tariffs on India ? EXPLAINED
20-08-2025 08:45,"Stocks to buy : Bajaj Auto , Ashok Leyland among Axis Securitie top auto picks after Q1 results , GST rate cut hopes"
18-08-2025 03:00,"How will markets open today ? GST reforms , GIFT Nifty up 230 points , and 6 other cues at this hour"
18-08-2025 03:00,Market Watchlist : Is August set for another washout as FIIs short Index Futures ? 10 stocks to watch for a turnaround
21-08-2025 09:45,"SBI introduces Dynamic Asset Allocation FoF , Axis rolls out Quality 50 Index Fund"
18-08-2025 06:30,"Asian markets : Stocks drift , Sensex eyes gap - up as world awaits Washington summit"
20-08-2025 16:00,Ahead of Market : 10 things that will decide stock market action on Thursday
18-08-2025 10:00,"POSCO , JSW Steel plan $8 - 9 bn Odisha plant in high - stakes joint venture"
22-08-2025 15:30,Kirloskar vs Kirloskar : Setback for Kirloskar Brothers in trademark suit ; court cites  blatant forum shopping  
18-08-2025 03:00,"From KEC International , Vedanta , RVNL to BPCL - Here are 10 stocks to watch - Market News"
19-08-2025 21:00,"Gold Prices Likely to Hit $3 , 600 by Year - End as Global Uncertainty Fuels Demand"
18-08-2025 16:15,Ahead of Market : 10 things that will decide stock market action on Tuesday
18-08-2025 08:45,Grasim Industries shares jump 3 . 11 % amid volume surge
21-08-2025 14:30,"PSU bank stocks outshine private peers in August rebound ; Indian Bank , BOI , SBI rally up to 8 % "
19-08-2025 21:00,"Gold prices to touch $3 , 600 per ounce by year - end"
17-08-2025 11:45,Ahead of Market : 10 things that will decide stock market action on Monday
21-08-2025 16:45,Ahead of Market : 10 things that will decide stock market action on Friday
19-08-2025 14:30,Markets tread water ahead of Powell Jackson Hole speech
19-08-2025 09:15,GST reforms and inflation : Will Modi government move pave the way for an RBI rate cut ? 
18-08-2025 10:45,Hindalco Industries shares jump 2 . 88 % amid volume surge
22-08-2025 10:15,Former Siemens and Alcoa CEO Klaus Kleinfeld dismisses the idea of work - life separation :  You are one person  
20-08-2025 06:45,"Nifty hovers below 25 , 000 mark as global weakness and AI rally concerns dampen sentiment"
18-08-2025 11:00,"GST reforms booster : Sensex surges 676 points , Nifty gains 245 points"
22-08-2025 18:45,"Indian Stocks End Six - Day Rally , Fall on Weak Global Cues and Fed Jitters"
19-08-2025 07:15,"Nifty opens flat as markets eye 25 , 000 resistance ; GST reform optimism counters Trump tariff concerns"
22-08-2025 04:00,"fii : ETMarkets Smart Talk| FII selling shifts flows to Korea , Taiwan , Japan ; DIIs remain net buyers : Dr . Poonam Tandon"
19-08-2025 09:30,"Nifty 50 may touch 28 , 000 due to GST rationalisation ; a growth - accretive reform : Report"
19-08-2025 05:45,"Hyundai Motor India shares jump 2 . 96 % with high volumes , among top gainers on Nifty Next 50"
18-08-2025 04:00,Nifty To Open Higher Today As GIFT Nifty Jumps Over 265 Points : Know Key Cues For August 18
20-08-2025 03:30,Recommended stocks to buy on 20 August top stock picks from market experts
18-08-2025 04:00,Recommended stocks to buy : Top stock picks for 18 August by market experts
18-08-2025 04:00,Best stocks to buy today : Ankush Bajaj top three recommendations for 18 August
19-08-2025 21:30,Beyond Jane Street
18-08-2025 08:00,4 high - yield dividend stocks for passive income in 2025
19-08-2025 05:15,"Nifty , Sensex open higher amid positive buzz on GST reforms"
19-08-2025 16:15,"Indian markets close higher on GST reform hopes , Russia - Ukraine peace developments"
19-08-2025 12:45,"Indian markets close higher on GST reform hopes , Russia - Ukraine peace developments"
20-08-2025 09:15,"Comex gold prices projected to touch USD 3 , 600 by year - end : Report"
18-08-2025 05:00,"Why market is rising today ? Sensex soars 1 , 100 pts , Nifty tops 25K ; GST reforms among 4 key factors behind today surge"
18-08-2025 06:00,"Sensex , Nifty jump over 1 . 3 pc ; auto stocks lead rally"
20-08-2025 18:45,"Indian stock benchmarks extend gains ; Sensex gains 213 points , Nifty tops 25K"
20-08-2025 15:15,"Indian stock benchmarks extend gains ; Sensex gains 213 points , Nifty tops 25K"
23-08-2025 10:15,India : Trading Blunder Triggers $749 Million Clean Science Share Shuffle
20-08-2025 15:45,Sensex Rallies 213 Points IT FMCG Sectors Lead Gains
19-08-2025 06:45,"Nifty , Sensex open flat as investors track Ukraine peace talks ; Oil , Metal and Media shares gain"
22-08-2025 10:00,"Indian equities open lower ; Nifty slips below 25 , 000 before US tariffs come in effect"
21-08-2025 13:45,"Indian stock market ends higher on hopes of GST rate cut , rises for 6th straight session"
22-08-2025 08:00,"Indian equities open lower ; Nifty slips below 25 , 000 before US tariffs come in effect"
19-08-2025 07:30,"Nifty , Sensex open flat as investors track Ukraine peace talks ; Oil , Metal and Media shares gain"
20-08-2025 07:00,"August 20 : Nifty , Sensex slip marginally in early trade amid mixed global cues"
21-08-2025 16:00,"Indian stock market ends higher on hopes of GST rate cut , rises for 6th straight session"
22-08-2025 08:15,"Indian equities open lower ; Nifty slips below 25 , 000 before US tariffs come in effect"
22-08-2025 21:30,"Indian stock market ends higher on hopes of GST rate cut , rises for 6th straight session"
22-08-2025 21:30,"Indian equities open lower ; Nifty slips below 25 , 000 before US tariffs come in effect"
23-08-2025 10:15,"F & O Talk| Nifty rally stalls at key Fibonacci hurdle , Bears return at higher levels : Sudeep Shah"
20-08-2025 04:45,Tata Consultancy Services shares rise in early trade
22-08-2025 03:30,"Trade Spotlight : How should you trade DMart , Can Fin Homes , Radico Khaitan , Cipla , Dr Reddys Labs , Caplin Point , Afcons Infra , and others on August 22 ? "
18-08-2025 06:00,"Nifty , Sensex rally in opening trade on GST cuts and S & P sovereign rating upgrade for India"
20-08-2025 06:45,"Nifty , Sensex open flat as FPI outflows weigh on sentiment despite govt boosters"
21-08-2025 08:15,"Nifty , Sensex continue to gain on Thursday opening , investors to track Powell speech Ukraine talks"
22-08-2025 13:00,Bank of America Says Nifty Fifty In Troubleas 5 Low PE Dividend Strong Buy Bargains
17-08-2025 14:30,Vijay L Bhambwani Ticker : Markets will revert to fundamentals
22-08-2025 03:15,Mint Explainer | What India Inc Q1 results mean for market investors
22-08-2025 11:00,Asia stocks cautiously advance ahead of Powell speech ; Japan mixed on sticky CPI
20-08-2025 07:00,Swiggy shares rise 2 . 03 % in Wednesday trading session
23-08-2025 01:00,Investing in India $250 billion IT services sector ? Here all you need to know
18-08-2025 08:15,Dollar Still Struggles to Avoid Further Losses
20-08-2025 07:00,Divis Laboratories shares fall 2 . 01 %; among top losers on Nifty Next 50
21-08-2025 02:45,Ultimate  smart money  signal - 2 small - caps FIIs and DIIs are both buying aggressively - Stock Insights News
20-08-2025 18:45,"Indian Markets Extend Rally for Third Straight Day , Sensex Gains 213 Points"
20-08-2025 07:00,LTIMindtree shares rise 2 . 08 % in Wednesday trading session
18-08-2025 11:15,"GST reforms booster : Sensex surges 676 points , Nifty gains 245 points"
24-08-2025 10:45,"Nifty Next 50 rejig : Siemens Energy , Hindustan Zinc , Mazagon Dock , Solar Industries added to index"
26-08-2025 03:15,"Nifty 50 , Sensex today : What to expect from Indian stock market in trade on August 26 ahead of Trump tariffs"
29-08-2025 12:30,Gold vs Nifty 50 vs FD : Which has given highest return on Rs 1 lakh investment in 10 years ? 
25-08-2025 10:45,"Sensex gains over 300 points , Nifty 50 ends above 24 , 950 10 key highlights from the Indian stock market today"
28-08-2025 08:30,"Indian stock market : Nifty 50 holds above 24 , 500 despite Trump tariffs . Key technical levels you must know"
29-08-2025 11:00,"Sensex , Nifty 50 fall for 3rd consecutive session 10 key highlights from stock market today"
26-08-2025 09:30,"Nifty Prediction Todayas August 26 , 2025 : Nifty 50 Futures : Resistance can cap the upside . Go short on a rise"
28-08-2025 03:15,"Nifty 50 , Sensex today : What to expect from Indian stock market in trade on August 28 after Trump tariffs"
29-08-2025 02:45,"Nifty 50 , Sensex today : What to expect from Indian stock market in trade on August 29 amid Trump tariff worries"
29-08-2025 06:30,"Nifty Prediction Todayas August 29 , 2025 : Nifty 50 Futures : Can be range bound with a bearish bias . Go short on a rise"
26-08-2025 03:15,Shares to buy or sell : Chandan Taparia recommends three stocks to buy and sell today - 26 August 2025
27-08-2025 05:30,"Stock market crash : Can Nifty 50 touch 24 , 000 amid renewed fear of Trump tariffs on India ? "
28-08-2025 11:00,"Sensex extends losses to 2nd straight session , investors losea‚¹4 lakh crore 10 key highlights from stock market today"
26-08-2025 09:15,"FPI ownership in NSE - listed firms drops to 13 - year low , domestic mutual funds strengthen hold to all - time high"
25-08-2025 16:00,"Stock Market Updates : Sensex And Nifty End Higher As Market Eyes Fed Cuts , GST Boost - Here Is Everything You Need To Know"
29-08-2025 02:45,Buy or sell : Vaishali Parekh recommends three intraday stocks to buy today 29 August 2025
27-08-2025 13:15,Trump Tariff Vs India : Nifty 50 rallies 10 % since February lows despite 50 % US Levyas Explained
28-08-2025 12:15,Nifty 50 ends below 100 EMA : What lies ahead for Indian stock market investors amid Trump tariff turbulence ? 
28-08-2025 08:15,Sensex recovers from 600 - point dip as Trump tariffs test Indian share markets
26-08-2025 02:15,"Stock Market LIVE Updates : GIFT Nifty indicates a weak start ; US , Asian markets fall"
28-08-2025 03:15,Buy or sell : Vaishali Parekh recommends three stocks to buy today despite Trump tariff tension
29-08-2025 05:15,"Markets kickoff September series on muted note : Nifty below 24 , 500 , Sensex at 80 , 100 ; M & M down 2 % "
